{
  "version": "2.0.0",
  "generatedAt": "2026-07-01T11:37:24.690Z",
  "source": "registries/repos",
  "generatedFrom": {
    "curatedSeeds": 17,
    "starredImported": 66,
    "starredSelected": 25
  },
  "entries": [
    {
      "id": "alexpate/awesome-design-systems",
      "slug": "alexpate-awesome-design-systems",
      "owner": "alexpate",
      "repo": "awesome-design-systems",
      "name": "awesome-design-systems",
      "url": "https://github.com/alexpate/awesome-design-systems",
      "entryPath": "registries/repos/alexpate-awesome-design-systems.json",
      "category": "design-systems",
      "type": "tooling",
      "aliases": [
        "awesome-design-systems",
        "alexpate/awesome-design-systems",
        "alexpate-awesome-design-systems"
      ],
      "stack": [
        "awesome",
        "awesome-list",
        "design-systems",
        "hacktoberfest",
        "pattern-library",
        "ui-library"
      ],
      "tags": [
        "awesome",
        "awesome-list",
        "design-systems",
        "hacktoberfest",
        "pattern-library",
        "ui-library",
        "tooling",
        "awesome-design-systems",
        "alexpate"
      ],
      "summary": "💅🏻 ⚒ A collection of awesome design systems",
      "primaryUseCases": [
        "starred repo review",
        "candidate triage"
      ],
      "acquisitionMode": "reference-only",
      "riskLevel": "low",
      "reviewRequiredBeforeUse": true,
      "recommendedAgentAction": "compare-before-adoption",
      "searchText": "alexpate/awesome-design-systems alexpate-awesome-design-systems alexpate awesome-design-systems https://github.com/alexpate/awesome-design-systems design-systems tooling awesome awesome-list hacktoberfest pattern-library ui-library 💅🏻 ⚒ A collection of awesome design systems starred repo review candidate triage Inspect the imported starred metadata and compare it with alternatives before recommending any adoption. https://git.io/design-systems",
      "license": "Unlicense",
      "maintenanceState": "active"
    },
    {
      "id": "ant-design/ant-design",
      "slug": "ant-design-ant-design",
      "owner": "ant-design",
      "repo": "ant-design",
      "name": "ant-design",
      "url": "https://github.com/ant-design/ant-design",
      "entryPath": "registries/repos/ant-design-ant-design.json",
      "category": "design-systems",
      "type": "design-system",
      "aliases": [
        "Ant Design",
        "antd",
        "ant-design",
        "ant-design-ant-design"
      ],
      "stack": [
        "React",
        "TypeScript",
        "ant-design",
        "antd",
        "design-systems",
        "react",
        "typescript",
        "ui-kit",
        "ui-library"
      ],
      "tags": [
        "ant-design",
        "antd",
        "design-systems",
        "react",
        "typescript",
        "ui-kit",
        "ui-library",
        "design-system"
      ],
      "summary": "Enterprise-focused React design system with a wide surface area.",
      "primaryUseCases": [
        "enterprise app UI",
        "forms",
        "tables"
      ],
      "acquisitionMode": "dependency-candidate",
      "riskLevel": "low",
      "reviewRequiredBeforeUse": true,
      "recommendedAgentAction": "compare-before-adoption",
      "searchText": "ant-design/ant-design ant-design-ant-design ant-design https://github.com/ant-design/ant-design design-systems design-system Ant Design antd React TypeScript react typescript ui-kit ui-library Enterprise-focused React design system with a wide surface area. enterprise app UI forms tables Use for reference or adoption after comparing bundle and API complexity. mui/material-ui mantinedev/mantine https://ant.design",
      "license": "MIT",
      "maintenanceState": "active"
    },
    {
      "id": "brillout/awesome-react-components",
      "slug": "brillout-awesome-react-components",
      "owner": "brillout",
      "repo": "awesome-react-components",
      "name": "awesome-react-components",
      "url": "https://github.com/brillout/awesome-react-components",
      "entryPath": "registries/repos/awesome-react-components.json",
      "category": "react-source-maps",
      "type": "collection",
      "aliases": [
        "awesome-react-components",
        "brillout-awesome-react-components"
      ],
      "stack": [
        "React"
      ],
      "tags": [
        "react-source-maps",
        "collection",
        "awesome-react-components",
        "brillout"
      ],
      "summary": "Curated catalog of React component libraries and UI building blocks.",
      "primaryUseCases": [
        "component library discovery",
        "UI comparison",
        "React pattern lookup"
      ],
      "acquisitionMode": "reference-map-only",
      "riskLevel": "low",
      "reviewRequiredBeforeUse": false,
      "recommendedAgentAction": "search-the-map",
      "searchText": "brillout/awesome-react-components brillout-awesome-react-components brillout awesome-react-components https://github.com/brillout/awesome-react-components react-source-maps collection React Curated catalog of React component libraries and UI building blocks. component library discovery UI comparison React pattern lookup Treat as a curated discovery layer, not as a runtime dependency. enaqx/awesome-react mui/material-ui mantinedev/mantine",
      "license": "NOASSERTION",
      "maintenanceState": "active"
    },
    {
      "id": "browser-use/video-use",
      "slug": "browser-use-video-use",
      "owner": "browser-use",
      "repo": "video-use",
      "name": "video-use",
      "url": "https://github.com/browser-use/video-use",
      "entryPath": "registries/repos/browser-use-video-use.json",
      "category": "video-generation",
      "type": "tooling",
      "aliases": [
        "video-use",
        "browser-use/video-use",
        "browser-use-video-use"
      ],
      "stack": [
        "Python"
      ],
      "tags": [
        "video-generation",
        "tooling",
        "video-use",
        "browser-use"
      ],
      "summary": "Edit videos with coding agents",
      "primaryUseCases": [
        "starred repo review",
        "candidate triage"
      ],
      "acquisitionMode": "implementation-pattern",
      "riskLevel": "low",
      "reviewRequiredBeforeUse": true,
      "recommendedAgentAction": "compare-before-adoption",
      "searchText": "browser-use/video-use browser-use-video-use browser-use video-use https://github.com/browser-use/video-use video-generation tooling Python Edit videos with coding agents starred repo review candidate triage Inspect the imported starred metadata and compare it with alternatives before recommending any adoption.",
      "license": "MIT",
      "maintenanceState": "active"
    },
    {
      "id": "collections/clean-code-linters",
      "slug": "collections-clean-code-linters",
      "owner": "github",
      "repo": "collections/clean-code-linters",
      "name": "collections/clean-code-linters",
      "url": "https://github.com/collections/clean-code-linters",
      "entryPath": "registries/repos/collections-clean-code-linters.json",
      "category": "code-quality",
      "type": "collection",
      "aliases": [
        "clean code linters",
        "collections/clean-code-linters",
        "collections-clean-code-linters"
      ],
      "stack": [
        "GitHub"
      ],
      "tags": [
        "code-quality",
        "collection",
        "collections/clean-code-linters",
        "github"
      ],
      "summary": "GitHub collection focused on code-quality and linting tools.",
      "primaryUseCases": [
        "linting research",
        "code-quality tooling discovery"
      ],
      "acquisitionMode": "reference-map-only",
      "riskLevel": "low",
      "reviewRequiredBeforeUse": false,
      "recommendedAgentAction": "search-the-map",
      "searchText": "collections/clean-code-linters collections-clean-code-linters github https://github.com/collections/clean-code-linters code-quality collection clean code linters GitHub GitHub collection focused on code-quality and linting tools. linting research code-quality tooling discovery Use as a discovery surface for code-quality tooling, then validate individual tools separately. github/topics/code-quality",
      "license": "NOASSERTION",
      "maintenanceState": "active"
    },
    {
      "id": "coreyhaines31/marketingskills",
      "slug": "coreyhaines31-marketingskills",
      "owner": "coreyhaines31",
      "repo": "marketingskills",
      "name": "marketingskills",
      "url": "https://github.com/coreyhaines31/marketingskills",
      "entryPath": "registries/repos/coreyhaines31-marketingskills.json",
      "category": "agent-frameworks",
      "type": "tooling",
      "aliases": [
        "marketingskills",
        "coreyhaines31/marketingskills",
        "coreyhaines31-marketingskills"
      ],
      "stack": [
        "JavaScript",
        "claude",
        "codex",
        "marketing"
      ],
      "tags": [
        "claude",
        "codex",
        "marketing",
        "agent-frameworks",
        "tooling",
        "marketingskills",
        "coreyhaines31"
      ],
      "summary": "Marketing skills for Claude Code and AI agents. CRO, copywriting, SEO, analytics, and growth engineering.",
      "primaryUseCases": [
        "starred repo review",
        "candidate triage"
      ],
      "acquisitionMode": "sandbox-research-only",
      "riskLevel": "high",
      "reviewRequiredBeforeUse": true,
      "recommendedAgentAction": "compare-before-adoption",